PK;NOMBRE;DESCRIPCION-ENTIDAD;HORARIO;EQUIPAMIENTO;TRANSPORTE;DESCRIPCION;ACCESIBILIDAD;CONTENT-URL;NOMBRE-VIA;CLASE-VIAL;TIPO-NUM;NUM;PLANTA;PUERTA;ESCALERAS;ORIENTACION;LOCALIDAD;PROVINCIA;CODIGO-POSTAL;BARRIO;DISTRITO;COORDENADA-X;COORDENADA-Y;LATITUD;LONGITUD;TELEFONO;FAX;EMAIL;TIPO;
4815260;"Sala de estudio Marconi";"";"Consultar telefónicamente.";"Puestos de lectura: 16";"Bus: 79";"";"0";"http://www.madrid.es/sites/v/index.jsp?vgnextchannel=bfa48ab43d6bb410VgnVCM100000171f5a0aRCRD&vgnextoid=fcffc1e158558110VgnVCM1000000b205a0aRCRD";"COLONIA MARCONI";"ACCESO";"V";"4";"";"";"";"";"MADRID";"MADRID";"28021";"SAN ANDRES";"VILLAVERDE";"440582";"4465356";"40.334751832113774";"-3.700809560921597";"917 100 232";"";"";"/contenido/entidadesYorganismos/SalasEstudioLectura"; 
5753637;"Sala de estudio Montecarmelo (Fuencarral - El Pardo)";"Reservas:  Es necesario la reserva previa Se podrá reservar sólo un turno con una antelación de 48 horas presencialmente o en el teléfono 917 364 151 Una vez abierta la sala, en el caso de que existan puestos libres se accederá por orden de llegada. Cuando es utilizado un puesto, éste no se podrá ocupar hasta el siguiente turno, una vez que se haya realizado la limpieza de la sala. Por lo tanto, en cada turno se pueden reservar todos los puestos en horario completo, pero no hay renovación de las personas, aunque se vayan antes de acabar el turno.";"De lunes a viernes Turno de mañana- de 9 a 14 horas Turno de tarde- de 16 a 21 horas";"Normas generales:  Uso obligatorio de la mascarilla. Mantener distancia de seguridad. Una vez se ocupa el puesto, queda terminantemente prohibido cambiar de sitio o puesto.             Prohibido comer en la sala. Mantenerse en silencio. Cumplir los horarios estipulados. El incumplimiento de estas normas puede suponer la denegación de uso de la sala.";"";"";"1";"http://www.madrid.es/sites/v/index.jsp?vgnextchannel=bfa48ab43d6bb410VgnVCM100000171f5a0aRCRD&vgnextoid=ae87964bd47a9210VgnVCM1000000b205a0aRCRD";"Santuario de Valverde.";"Avenida";"T";"114";"";"";"";"Carretera M-607 km 13-L10. Acceso a través del PAU Montecarmelo";"MADRID";"MADRID";"28049";"EL GOLOSO";"FUENCARRAL-EL PARDO";"441892";"4485296";"40.51635495615339";"-3.685946562681175";"917 364 151";"";"";"/contenido/entidadesYorganismos/SalasEstudioLectura"; 
10751094;"Sala de estudio Motilla del Palancar (Hortaleza)";"";"De lunes a domingos y festivos, de 9 a 22 horas.";"Puestos de lectura: 60 Wifi";"Metro: Canillas (línea 4)  Bus: 73, 120, 112, 153";"";"0";"http://www.madrid.es/sites/v/index.jsp?vgnextchannel=bfa48ab43d6bb410VgnVCM100000171f5a0aRCRD&vgnextoid=f2114531d18a4610VgnVCM1000001d4a900aRCRD";"MOTILLA DEL PALANCAR";"CALLE";"V";"13";"local bajo";"";"";"posterior, con vuelta a calle Pedro Alonso";"MADRID";"MADRID";"28043";"CANILLAS";"HORTALEZA";"446308";"4479597";"40.46532067984838";"-3.633321598436636";"683 498 715";"";"";"/contenido/entidadesYorganismos/SalasEstudioLectura"; 
4814223;"Sala de estudio Oporto (Carabanchel)";"";"Lunes a viernes: de 9 a 14 y de 16:30 a 20:30 horas. Sábados: de 10 a 13:30 y de 16:30 a 20:30 horas. Agosto cerrado.";"Puestos de lectura: 20 Zona wifi en planta baja.";"Metro: Oporto (líneas 5, 6) , Opañel (línea 6)  Bus: 55, 81, 108, 118, 81, 247";"";"1";"http://www.madrid.es/sites/v/index.jsp?vgnextchannel=bfa48ab43d6bb410VgnVCM100000171f5a0aRCRD&vgnextoid=0295d1a2d9058110VgnVCM1000000b205a0aRCRD";"OPORTO";"AVENIDA";"V";"78";"";"";"";"";"MADRID";"MADRID";"28019";"OPAÑEL";"CARABANCHEL";"438232";"4470949";"40.38684744124125";"-3.727740326743959";"914 603 801";"";"";"/contenido/entidadesYorganismos/SalasEstudioLectura"; 
5753811;"Sala de estudio San Cristóbal";"";"Consultar telefónicamente.";"Puestos de lectura: 40";"Metro: Villaverde Alto (línea 3) Bus: 59, 79";"";"1";"http://www.madrid.es/sites/v/index.jsp?vgnextchannel=bfa48ab43d6bb410VgnVCM100000171f5a0aRCRD&vgnextoid=4ae90a3bb87a9210VgnVCM1000000b205a0aRCRD";"PINAZO";"PLAZA";"V";"9";"";"";"";"";"MADRID";"MADRID";"28021";"SAN CRISTOBAL";"VILLAVERDE";"441384";"4466229";"40.34267317099495";"-3.6914487380508842";"917 100 410";"";"";"/contenido/entidadesYorganismos/SalasEstudioLectura"; 
6478893;"Sala de estudio Sanchinarro (Hortaleza)";"";"De lunes a viernes: 9 a 15 y de 16 a 22 horas.";"Puestos de lectura: 61 Wifi";"Bus: 172, 173, 174";"";"1";"http://www.madrid.es/sites/v/index.jsp?vgnextchannel=bfa48ab43d6bb410VgnVCM100000171f5a0aRCRD&vgnextoid=459b10e528908310VgnVCM1000000b205a0aRCRD";"PRINCESA DE EBOLI";"CALLE";"V";"29";"";"";"";"ubicada en el Centro Cultural Sanchinarro";"MADRID";"MADRID";"28050";"VALDEFUENTES";"HORTALEZA";"444469";"4482391";"40.49035310157377";"-3.655261744717257";"915 000 603";"";"";"/contenido/entidadesYorganismos/SalasEstudioLectura"; 
4815268;"Sala de estudio Santa Petronila";"";"Consultar telefónicamente.";"Puestos de lectura: 15";"Metro: Villaverde Bajo Cruce (línea 3)  Bus: 59, 79, 85 Renfe: Villaverde Bajo";"";"1";"http://www.madrid.es/sites/v/index.jsp?vgnextchannel=bfa48ab43d6bb410VgnVCM100000171f5a0aRCRD&vgnextoid=5b65c1e158558110VgnVCM1000000b205a0aRCRD";"MARIA MARTINEZ OVIOL";"CALLE";"V";"12";"";"";"";"";"MADRID";"MADRID";"28021";"LOS ROSALES";"VILLAVERDE";"441386";"4467139";"40.35087114162283";"-3.691508909255186";"917 109 710";"";"";"/contenido/entidadesYorganismos/SalasEstudioLectura"; 
4815389;"Sala de estudio Valdebernardo (Vicálvaro)";"";"Sábados, domingos y festivos de 9 a 13:45 y de 16 a 19:45 horas. Agosto cerrado.";"";"Metro: Valdebernardo (línea 9).  Bus: 130, 71, 8.";"Dos salas de estudio. Puestos de lectura: 60. Zona wifi.";"1";"http://www.madrid.es/sites/v/index.jsp?vgnextchannel=bfa48ab43d6bb410VgnVCM100000171f5a0aRCRD&vgnextoid=1dc9c0e48a558110VgnVCM1000000b205a0aRCRD";"INDALECIO PRIETO";"BULEVAR";"V";"21";"";"";"";"";"MADRID";"MADRID";"28032";"CASCO H.VICALVARO";"VICALVARO";"447278";"4472321";"40.39982891410407";"-3.621281890570377";"913 016 460";"";"";"/contenido/entidadesYorganismos/SalasEstudioLectura"; 
10107814;"Sala de estudio y lectura Arquitecto Juan de Herrera (Latina)";"";"En horario de funcionamiento del centro:  Lunes a Viernes de 9 a 21:30 horas. Sábados de 9 a 13:30 horas.";"Puestos de lectura: 20 Zona wifi";"Bus: 119, 138";"";"1";"http://www.madrid.es/sites/v/index.jsp?vgnextchannel=bfa48ab43d6bb410VgnVCM100000171f5a0aRCRD&vgnextoid=6a6c61366ded5510VgnVCM1000001d4a900aRCRD";"MARIA DEL CARMEN";"CALLE";"V";"65";"";"";"";"";"MADRID";"MADRID";"28011";"PUERTA DEL ANGEL";"LATINA";"437830";"4473132";"40.40647389284976";"-3.7327010920242043";"914 649 304";"";"";"/contenido/entidadesYorganismos/SalasEstudioLectura"; 
10107379;"Sala de estudio y lectura Cayetano Pando (Latina)";"";"Abierta todo el año salvo segunda quincena de julio y primera de agosto.   Lunes a Viernes de 8 a 22 h.  Sábados de 9 a 14 h.  Julio y Septiembre: L a V de 9 a 21 h.  Agosto: L a V de 9 a 21 h.";"Puestos de lectura: 40.  Períodos extraordinarios de apertura:  PRIMER PERÍODO:   Del   29 de mayo al 11 de junio (ambos inclusive), en el siguiente horario:     De lunes a viernes.- De 8.00 a 22.00 horas     Sábados y Domingos.- De 9.00 a 22.00 horas   SEGUNDO PERÍODO:   Del   26 de junio al 9 de julio  (ambos inclusive), en el siguiente horario:     De lunes a viernes.- De 8.00 a 22.00 horas.     Sábados y Domingos.- De 9.00 a 22.00 horas.";"Metro: Lucero y Laguna (línea 6) Cercanías Renfe: Laguna (línea C5).  Bus: 31, 138.";"";"0";"http://www.madrid.es/sites/v/index.jsp?vgnextchannel=bfa48ab43d6bb410VgnVCM100000171f5a0aRCRD&vgnextoid=f565aea7089d5510VgnVCM1000001d4a900aRCRD";"CAYETANO PANDO";"CALLE";"V";"8";"";"";"";"";"MADRID";"MADRID";"28047";"LUCERO";"LATINA";"436652";"4472734";"40.40281371620686";"-3.746531777787898";"915 264 475";"";"";"/contenido/entidadesYorganismos/SalasEstudioLectura"; 
10107362;"Sala de estudio y lectura Cebreros (Latina)";"";"Abierta todo el año salvo segunda quincena de julio y primera de agosto   Lunes a Viernes de 8 a 22 h.   Sábados de 9 a 14 h.   Julio y Septiembre: L a V de 9 a 21 h.   Agosto: L a V de 9 a 21 h.";"Puestos de lectura: 63.  Períodos extraordinarios de apertura:  PRIMER PERÍODO:   Del   29 de mayo al 11 de junio (ambos inclusive), en el siguiente horario:     De lunes a viernes.- De 8.00 a 22.00 horas     Sábados y Domingos.- De 9.00 a 22.00 horas   SEGUNDO PERÍODO:   Del   26 de junio al 9 de julio  (ambos inclusive), en el siguiente horario:     De lunes a viernes.- De 8.00 a 22.00 horas.     Sábados y Domingos.- De 9.00 a 22.00 horas.";"Metro: Lucero (línea 6), Batán (línea 10). Bus: 138, 36, 39, 65.";"";"0";"http://www.madrid.es/sites/v/index.jsp?vgnextchannel=bfa48ab43d6bb410VgnVCM100000171f5a0aRCRD&vgnextoid=7d52aea7089d5510VgnVCM1000001d4a900aRCRD";"CEBREROS";"CALLE";"V";"66";"";"";"";"";"MADRID";"MADRID";"28011";"LUCERO";"LATINA";"436490";"4472992";"40.40512065478807";"-3.748466414403756";"914 796 964";"";"";"/contenido/entidadesYorganismos/SalasEstudioLectura"; 
8041433;"Sala de estudio y lectura Centro Sociocultural Latina (Latina)";"";"En horario de funcionamiento del centro:  Lunes a Viernes de 9 a 21:30 horas. Sábados de 9 a 13:30 horas.";"Puestos de lectura: 44. Zona wifi.";"Bus: 155. Cercanías Renfe: Fanjul (C5).";"";"1";"http://www.madrid.es/sites/v/index.jsp?vgnextchannel=bfa48ab43d6bb410VgnVCM100000171f5a0aRCRD&vgnextoid=9a9e1f61dd74d410VgnVCM1000000b205a0aRCRD";"RODRIGO DE ARANA";"CALLE";"V";"50";"";"";"";"";"MADRID";"MADRID";"28044";"LAS AGUILAS";"LATINA";"434982";"4470177";"40.3796456555054";"-3.7659493469010017";"915 095 470";"";"";"/contenido/entidadesYorganismos/SalasEstudioLectura"; 
10107702;"Sala de estudio y lectura Escritor Pedro de Répide (Latina)";"";"En horario de funcionamiento del centro:  Lunes a Viernes de 9 a 21:30 horas. Sábados de 9 a 13:30 horas.";"Puestos de lectura: 16 Zona wifi";"Bus: 119, 138";"";"1";"http://www.madrid.es/sites/v/index.jsp?vgnextchannel=bfa48ab43d6bb410VgnVCM100000171f5a0aRCRD&vgnextoid=5e0861366ded5510VgnVCM1000001d4a900aRCRD";"MARIA DEL CARMEN";"CALLE";"V";"65";"";"";"";"";"MADRID";"MADRID";"28011";"PUERTA DEL ANGEL";"LATINA";"437830";"4473132";"40.40647389284976";"-3.7327010920242043";"914 649 304";"";"";"/contenido/entidadesYorganismos/SalasEstudioLectura"; 
8041409;"Sala de estudio y lectura José Luis Sampedro (Latina)";"";"En horario de funcionamiento del centro:  Lunes a Viernes de 9 a 21:30 horas. Sábados de 9 a 13:30 horas.";"Puestos de lectura: 54. Zona wifi.";"Metro: Laguna (línea 6), Lucero (línea 6). Bus: 55. Renfe: Laguna (C5)";"";"1";"http://www.madrid.es/sites/v/index.jsp?vgnextchannel=bfa48ab43d6bb410VgnVCM100000171f5a0aRCRD&vgnextoid=a3e91f61dd74d410VgnVCM1000000b205a0aRCRD";"CASTROSERNA";"CALLE";"V";"4";"";"";"";"";"MADRID";"MADRID";"28047";"LUCERO";"LATINA";"436428";"4472623";"40.40179182285599";"-3.7491601722547996";"915 267 820 / 915 267 821";"";"";"/contenido/entidadesYorganismos/SalasEstudioLectura"; 
10107309;"Sala de estudio y lectura Maqueda (Latina)";"";"Abierta todo el año salvo segunda quincena de julio y primera de agosto   Lunes a Viernes de 8 a 22 h.   Sábados de 9 a 14 h.   Julio y Septiembre: L a V de 9 a 21 h.   Agosto: L a V de 9 a 21 h.";"Puestos de lectura: 68.  Períodos extraordinarios de apertura:  PRIMER PERÍODO:   Del   29 de mayo al 11 de junio (ambos inclusive), en el siguiente horario:     De lunes a viernes.- De 8.00 a 22.00 horas     Sábados y Domingos.- De 9.00 a 22.00 horas   SEGUNDO PERÍODO:   Del   26 de junio al 9 de julio  (ambos inclusive), en el siguiente horario:     De lunes a viernes.- De 8.00 a 22.00 horas.     Sábados y Domingos.- De 9.00 a 22.00 horas.";"Metro: Campamento (línea 5), Empalme (línea 10).  Bus: 121, 25.";"";"1";"http://www.madrid.es/sites/v/index.jsp?vgnextchannel=bfa48ab43d6bb410VgnVCM100000171f5a0aRCRD&vgnextoid=afacaea7089d5510VgnVCM1000001d4a900aRCRD";"MAQUEDA";"CALLE";"V";"5";"";"";"";"";"MADRID";"MADRID";"28024";"ALUCHE";"LATINA";"435108";"4471845";"40.39468264667264";"-3.7646257427725063";"917 110 369";"";"";"/contenido/entidadesYorganismos/SalasEstudioLectura"; 
8041448;"Sala de estudio y lectura Miguel Hernández (Latina)";"";"En horario de funcionamiento del centro:  Lunes a Viernes de 9 a 21:30 horas. Sábado de 9 a 13:30 horas.";"Puestos de lectura: 42.";"Bus: 34, 117, 139, 39. Cercanías Renfe: Las Aguilas (C5).";"";"1";"http://www.madrid.es/sites/v/index.jsp?vgnextchannel=bfa48ab43d6bb410VgnVCM100000171f5a0aRCRD&vgnextoid=b3431f61dd74d410VgnVCM1000000b205a0aRCRD";"SERRADILLA";"CALLE";"V";"13";"";"";"";"";"MADRID";"MADRID";"28044";"LAS AGUILAS";"LATINA";"433622";"4470101";"40.378853797128336";"-3.7819616113032115";"917 066 300";"";"";"/contenido/entidadesYorganismos/SalasEstudioLectura"; 
10107172;"Sala de estudio y lectura Paseo de Extremadura (Latina)";"";"Abierta todo el año salvo segunda quincena de julio y primera de agosto   Lunes a Viernes de 8 a 22 h.   Sábados de 9 a 14 h. .   Julio y Septiembre: L a V de 9 a 21 h.   Agosto: L a V de 9 a 21 h.";"Puestos de lectura: 48.  Períodos extraordinarios de apertura:  PRIMER PERÍODO:   Del   29 de mayo al 11 de junio (ambos inclusive), en el siguiente horario:     De lunes a viernes.- De 8.00 a 22.00 horas     Sábados y Domingos.- De 9.00 a 22.00 horas   SEGUNDO PERÍODO:   Del   26 de junio al 9 de julio  (ambos inclusive), en el siguiente horario:     De lunes a viernes.- De 8.00 a 22.00 horas.     Sábados y Domingos.- De 9.00 a 22.00 horas.";"Metro: Alto de Extremadura (línea 6).  Bus: 31, 33, 36, 39, 65.";"";"0";"http://www.madrid.es/sites/v/index.jsp?vgnextchannel=bfa48ab43d6bb410VgnVCM100000171f5a0aRCRD&vgnextoid=ae857f23530d5510VgnVCM2000001f4a900aRCRD";"EXTREMADURA";"PASEO";"V";"128";"";"";"";"";"MADRID";"MADRID";"28011";"PUERTA DEL ANGEL";"LATINA";"437569";"4473648";"40.411111789264716";"-3.7358157416157276";"914 634 249";"";"";"/contenido/entidadesYorganismos/SalasEstudioLectura"; 
8041514;"Sala de estudio y lectura Sara Montiel (Latina)";"";"En horario de funcionamiento del centro:  Lunes a Viernes de 9 a 21:30 horas. Sábados de 9 a 13:30 horas.";"Puestos de lectura: 54. Zona wifi.";"Metro: Colonia Jardín (líneas 10, ML2, ML3). Bus: 65, H.";"";"1";"http://www.madrid.es/sites/v/index.jsp?vgnextchannel=bfa48ab43d6bb410VgnVCM100000171f5a0aRCRD&vgnextoid=2cfd68daae74d410VgnVCM1000000b205a0aRCRD";"BOADILLA DEL MONTE";"CARRETERA";"V";"40";"";"";"";"";"MADRID";"MADRID";"28024";"CAMPAMENTO";"LATINA";"434937";"4472307";"40.398830008074896";"-3.7666969961921692";"915 120 890";"";"";"/contenido/entidadesYorganismos/SalasEstudioLectura"; 
7989332;"Sala de estudio y lectura del Centro Cultural Las Californias (Retiro)";"";"";"Zona wifi Atención básica en lengua de signos.";"Metro: Puente de Vallecas (línea 1) , Mendez Álvaro (línea 6)  Bus: 113, 148  Cercanías RENFE: Mendez Álvaro Estación Sur (líneas C1, C5, C7, C10, Regional)";"";"1,4";"http://www.madrid.es/sites/v/index.jsp?vgnextchannel=bfa48ab43d6bb410VgnVCM100000171f5a0aRCRD&vgnextoid=1626bbe4eb1cc410VgnVCM1000000b205a0aRCRD";"LUIS PEIDRO";"CALLE";"V";"2";"";"";"";"ubicada en el Centro Cultural Luis Peidró";"MADRID";"MADRID";"28007";"ADELFAS";"RETIRO";"442841";"4472041";"40.39701377469427";"-3.6735395596361586";"915 016 942";"";"";"/contenido/entidadesYorganismos/SalasEstudioLectura"; 
4815242;"Sala de estudio Ágata";"";"Consultar telefónicamente.";"Puestos de lectura: 25";"Bus: 22, 79, 86, 130, 131";"";"1";"http://www.madrid.es/sites/v/index.jsp?vgnextchannel=bfa48ab43d6bb410VgnVCM100000171f5a0aRCRD&vgnextoid=8a760c4d87558110VgnVCM1000000b205a0aRCRD";"DOCTOR MARTIN AREVALO";"CALLE";"V";"2";"";"";"";"";"MADRID";"MADRID";"28021";"SAN ANDRES";"VILLAVERDE";"439937";"4466650";"40.34636268334182";"-3.708524395897377";"917 109 300";"";"";"/contenido/entidadesYorganismos/SalasEstudioLectura"; 
4815493;"Sala de lectura Pilares (Barajas)";"";"De lunes a viernes, de 8 a 14 horas.";"Puestos de lectura: 72 (reducido 19) Wifi";"Metro: Barajas (línea 8)  Bus: 101, 105, 115";"";"1";"http://www.madrid.es/sites/v/index.jsp?vgnextchannel=bfa48ab43d6bb410VgnVCM100000171f5a0aRCRD&vgnextoid=747e48136c558110VgnVCM1000000b205a0aRCRD";"LOS PILARES";"CALLE";"V";"3";"";"";"";"";"MADRID";"MADRID";"28042";"CASCO H.BARAJAS";"BARAJAS";"451023";"4480645";"40.47504564286";"-3.577805996745736";"915 888 103";"";"";"/contenido/entidadesYorganismos/SalasEstudioLectura"; 
5753771;"Salas de estudio Centro Cultural Pozo del tío Raimundo (Puente de Vallecas)";"";"De lunes a viernes, de 8:30 a 21:30 horas. Sábados, de 10 a 13:45 y de 16 a 19:45 horas. Domingos y festivos, de 10 a 13:45 horas. Julio, de lunes a viernes de 8:30 a 20:30, sábados, domingos y festivos cerrado. Agosto cerrado.";"Puestos de lectura: 20, reducido a 10 puestos dividido en dos salas. Zona wifi.";"Bus: 102, 24, 103.  Cercanías Renfe: El Pozo (línea C2).";"";"1";"http://www.madrid.es/sites/v/index.jsp?vgnextchannel=bfa48ab43d6bb410VgnVCM100000171f5a0aRCRD&vgnextoid=9a831c35f67a9210VgnVCM1000000b205a0aRCRD";"DE LAS GLORIETAS";"AVENIDA";"V";"19";"";"";"";"19-21 entrada por la PLAZA DEL PADRE LLANOS";"MADRID";"MADRID";"28053";"ENTREVIAS";"PUENTE DE VALLECAS";"443950";"4469433";"40.3735856436473";"-3.6602546064905397";"917 866 372 / 917 866 644";"";"";"/contenido/entidadesYorganismos/SalasEstudioLectura"; 
7988710;"Salas de estudio Centro cultural Mercado de Ibiza (Retiro)";"";"De lunes a viernes, de 9 a 14 y de 16:30 a 20:30 horas. Sábados de 9 a 14 horas. Agosto cerrado.";"Dos salas de estudio y lectura:   Puestos de lectura: 38 Zona wifi";"Metro: Ibiza (línea 9)  Bus: 15, 2, 215, 26, 61, 63, C1, C2, 152, 20  Bicimad: Estación 181 (calle ibiza, 18)";"";"1";"http://www.madrid.es/sites/v/index.jsp?vgnextchannel=bfa48ab43d6bb410VgnVCM100000171f5a0aRCRD&vgnextoid=ddfec642771cc410VgnVCM1000000b205a0aRCRD";"IBIZA";"CALLE";"V";"8";"1ª";"";"";"ubicada en el Centro Cutural Mercado de Ibiza";"MADRID";"MADRID";"28009";"IBIZA";"RETIRO";"442533";"4474392";"40.41817164604735";"-3.6773809757021385";"915 572 601";"";"";"/contenido/entidadesYorganismos/SalasEstudioLectura"; 
8071910;"Salas de estudio Miguel de Cervantes (San Blas - Canillejas)";"";"Lunes a domingo de 10 a 14:30 y 16:30 a 21 horas.";"";"Bus: 140, 48, 167, 28";"Puestos de lectura: 58 Zona wifi";"1";"http://www.madrid.es/sites/v/index.jsp?vgnextchannel=bfa48ab43d6bb410VgnVCM100000171f5a0aRCRD&vgnextoid=4ef476e159ead410VgnVCM1000000b205a0aRCRD";"ALIAGA";"CALLE";"V";"5";"";"";"";"ubicada en el Centro Cultural Miguel de Cervantes";"MADRID";"MADRID";"28022";"CANILLEJAS";"SAN BLAS-CANILLEJAS";"448148";"4476402";"40.43664778776818";"-3.611362970564875";"917 430 078";"";"";"/contenido/entidadesYorganismos/SalasEstudioLectura"; 

