PK;NOMBRE;DESCRIPCION-ENTIDAD;HORARIO;EQUIPAMIENTO;TRANSPORTE;DESCRIPCION;ACCESIBILIDAD;CONTENT-URL;NOMBRE-VIA;CLASE-VIAL;TIPO-NUM;NUM;PLANTA;PUERTA;ESCALERAS;ORIENTACION;LOCALIDAD;PROVINCIA;CODIGO-POSTAL;BARRIO;DISTRITO;COORDENADA-X;COORDENADA-Y;LATITUD;LONGITUD;TELEFONO;FAX;EMAIL;TIPO;
11187846;"Aula de estudio Centro Cultural San Juan Bautista (Ciudad Lineal)";"";"Julio: Lunes a viernes, de 9:30  a 14 horas (domingos y festivos cerrado) Septiembre: Lunes a viernes, de 9:30  a 20:30 horas (domingos y festivos cerrado) Semana Santa: de 9:30 a 20 horas (domingos y festivos cerrado)";"Puestos de lectura: 15 (reducido 10). Se trata de un aula que se utiliza cuando no hay talleres, durante julio, septiembre y Semana Santa. Zona wifi";"Metro: Avenida de la Paz (línea 4)  Bus: 53";"";"1";"http://www.madrid.es/sites/v/index.jsp?vgnextchannel=bfa48ab43d6bb410VgnVCM100000171f5a0aRCRD&vgnextoid=e10cd76f718a2710VgnVCM1000001d4a900aRCRD";"SAN NEMESIO";"CALLE";"V";"4";"";"";"";"";"MADRID";"MADRID";"28043";"SAN JUAN BAUTISTA";"CIUDAD LINEAL";"444202";"4478162";"40.45224710166";"-3.658029027767765";"914 157 705";"";"";"/contenido/entidadesYorganismos/SalasEstudioLectura"; 
1958;"Centro Cultural San Juan Bautista (Ciudad Lineal)";"";"De lunes a viernes, de 10 a 14 y de 15 a 18 horas. Julio, de lunes a viernes, de 10 a 14 horas. Agosto cerrado. Fuera de este horario el centro permanecerá abierto durante la celebración de las actividades que se programen.";"Sala de exposiciones Sala de lectura y estuduo Salón de actos / auditorio (aforo 208) 6 Aulas Zona wifi   Sala de lectura y estudio: Durante el mes de julio, de 10 a 14 horas.";"Metro: Avenida de la Paz (línea 4)  Bus: 53";"";"1";"http://www.madrid.es/sites/v/index.jsp?vgnextchannel=bfa48ab43d6bb410VgnVCM100000171f5a0aRCRD&vgnextoid=618b1e79ee71c010VgnVCM1000000b205a0aRCRD";"SAN NEMESIO";"CALLE";"V";"4";"";"";"";"";"MADRID";"MADRID";"28043";"SAN JUAN BAUTISTA";"CIUDAD LINEAL";"444202";"4478162";"40.45224737965276";"-3.6580402287911937";"914 157 705";"";"ccsanjuanbautista@madrid.es";"/contenido/entidadesYorganismos/SalasEstudioLectura"; 
8637537;"Sala de Estudio del Centro Sociocultural Clara Campoamor (Retiro)";"Normas generales   Uso obligatorio de mascarilla en todo momento Distancia de seguridad. Queda prohibido modificar la disposición de las mesas y sillas En todo momento tendrán que atender las directrices de las auxiliares de información y del personal de seguridad Queda prohibido el consumo de bebidas/comida No se permite pre-reservar ni guardar los puestos                                                                                                                       Sala Dulce Chacón (1&amp;ordf; planta): 20 puestos. Esta sala no podrá usarse como sala de estudio cuando esté ocupada por cesiones/actividades socioculturales     Sala de estudio Gloria Fuertes (2&amp;ordf; planta): 24 puestos .  Sala Las Sinsombrero (2&amp;ordf; y 3&amp;ordf; planta): 24 puestos. Esta sala no podrá usarse como sala de estudio cuando esté ocupada por cesiones/actividades socioculturales.";"Lunes a viernes de 9 a 21 h.  Sábados, domingos y festivos de 10 a 21 h. (Con excepción del 25 de diciembre y 1 y 6 de enero en los que la Junta Municipal permanece cerrada).";"Zona wifi";"Metro: Pacífico (línea 1 y 6)  Bus: 24, 37, 54, 57, 141  Bicimad: Estación 178 (calle León Gil de Palacio, 3)  Aparcamiento: Daoíz y Velarde (23), avenida Ciudad de Barcelona ( calle Alberche y calle Téllez)";"Acceso por plaza de Daoíz y Velarde.";"1";"http://www.madrid.es/sites/v/index.jsp?vgnextchannel=bfa48ab43d6bb410VgnVCM100000171f5a0aRCRD&vgnextoid=ad345442c6452510VgnVCM2000000c205a0aRCRD";"DAOIZ Y VELARDE";"PLAZA";"V";"2";"";"";"";"";"MADRID";"MADRID";"28007";"PACIFICO";"RETIRO";"442527";"4472618";"40.402190438836826";"-3.6772826298329093";"915 886 348";"";"";"/contenido/entidadesYorganismos/SalasEstudioLectura"; 
4813751;"Sala de estudio Alfonso XII (Fuencarral - El Pardo)";"Reservas:  Es necesario la reserva previa Se podrá reservar sólo un turno con una antelación de 48 horas presencialmente o en el teléfono 913 762 060 Una vez abierta la sala, en el caso de que existan puestos libres se accederá por orden de llegada. Cuando es utilizado un puesto, éste no se podrá ocupar hasta el siguiente turno, una vez que se haya realizado la limpieza de la sala. Por lo tanto, en cada turno se pueden reservar todos los puestos en horario completo, pero no hay renovación de las personas, aunque se vayan antes de acabar el turno.";"De lunes a viernes Turno de mañana- de 9 a 14 horas Turno de tarde- de 16 a 21 horas";"Normas generales:  Uso obligatorio de la mascarilla. Mantener distancia de seguridad. Una vez se ocupa el puesto, queda terminantemente prohibido cambiar de sitio o puesto.            Prohibido comer en la sala. Mantenerse en silencio. Cumplir los horarios estipulados. El incumplimiento de estas normas puede suponer la denegación de uso de la sala.";"";"";"1";"http://www.madrid.es/sites/v/index.jsp?vgnextchannel=bfa48ab43d6bb410VgnVCM100000171f5a0aRCRD&vgnextoid=2e7a8917a2058110VgnVCM2000000c205a0aRCRD";"MIRA EL RIO";"CALLE";"V";"4";"";"";"";"";"MADRID";"MADRID";"28048";"EL PARDO";"FUENCARRAL-EL PARDO";"434105";"4485730";"40.519673311658686";"-3.7779055687726535";"913 762 060";"";"";"/contenido/entidadesYorganismos/SalasEstudioLectura"; 
4813737;"Sala de estudio Alfredo Kraus (Fuencarral - El Pardo)";"Reservas:  Es necesario la reserva previa Se podrá reservar sólo un turno con una antelación de 48 horas presencialmente o en el teléfono 913 767 085 Una vez abierta la sala, en el caso de que existan puestos libres se accederá por orden de llegada. Cuando es utilizado un puesto, éste no se podrá ocupar hasta el siguiente turno, una vez que se haya realizado la limpieza de la sala. Por lo tanto, en cada turno se pueden reservar todos los puestos en horario completo, pero no hay renovación de las personas, aunque se vayan antes de acabar el turno.";"De lunes a viernes Turno de mañana- de 9 a 14 horas Turno de tarde- de 16 a 21 horas";"Normas generales:  Uso obligatorio de la mascarilla. Mantener distancia de seguridad. Una vez se ocupa el puesto, queda terminantemente prohibido cambiar de sitio o puesto.            Prohibido comer en la sala. Mantenerse en silencio. Cumplir los horarios estipulados. El incumplimiento de estas normas puede suponer la denegación de uso de la sala.";"";"";"1";"http://www.madrid.es/sites/v/index.jsp?vgnextchannel=bfa48ab43d6bb410VgnVCM100000171f5a0aRCRD&vgnextoid=2ec62928b1058110VgnVCM2000000c205a0aRCRD";"PRADERA DE VAQUERIZAS";"GLORIETA";"V";"9";"";"";"";"";"MADRID";"MADRID";"28035";"MIRASIERRA";"FUENCARRAL-EL PARDO";"438848";"4482487";"40.49082275610172";"-3.7216054330053647";"913 767 085 (Centro Cultural)";"";"";"/contenido/entidadesYorganismos/SalasEstudioLectura"; 
8041076;"Sala de estudio Almirante Churruca (Latina)";"";"En horario de funcionamiento del centro:  Lunes a Viernes de 9 a 21:30 horas. Sábados de 9 a 13:30 horas.";"Puestos de lectura: 120. Wifi.";"Metro: Aviación Española (línea 10). Bus: 17, 34. Cercanías Renfe: Las Águilas (línea C5).";"";"1";"http://www.madrid.es/sites/v/index.jsp?vgnextchannel=bfa48ab43d6bb410VgnVCM100000171f5a0aRCRD&vgnextoid=3ab67c6cd874d410VgnVCM1000000b205a0aRCRD";"FUENTE DEL TIRO";"CALLE";"V";"72";"1.ª";"";"";"";"MADRID";"MADRID";"28024";"LAS AGUILAS";"LATINA";"433786";"4470559";"40.382992678408066";"-3.7800773802118117";"915 090 581 / 917 053 794";"";"";"/contenido/entidadesYorganismos/SalasEstudioLectura"; 
10415134;"Sala de estudio Aravaca (Moncloa-Aravaca)";"";"De lunes a sábado de 9 a 14 y de 15 a 21 horas.";"";"Bus: 160, 161.";"Puestos de lectura: 8 (de los 32 quedan reducidos a 8 por motivos de seguridad sanitaria). Zona wifi.";"1";"http://www.madrid.es/sites/v/index.jsp?vgnextchannel=bfa48ab43d6bb410VgnVCM100000171f5a0aRCRD&vgnextoid=4b308cfd9a8ec510VgnVCM2000001f4a900aRCRD";"ZARZA";"CALLE";"V";"20";"";"";"";"";"MADRID";"MADRID";"28023";"ARAVACA";"MONCLOA-ARAVACA";"433370";"4478937";"40.45843103553325";"-3.785855667139094";"917 401 596";"";"";"/contenido/entidadesYorganismos/SalasEstudioLectura"; 
4815112;"Sala de estudio Carril del Conde (Hortaleza)";"";"Horario habitual: De lunes a domingos y festivos, de 9 a 22 horas.  Julio y agosto cerrado.";"Puestos de lectura: 150 Wifi";"Metro: Arturo Soria (línea 4)  Bus: 9, 72, 73";"";"1";"http://www.madrid.es/sites/v/index.jsp?vgnextchannel=bfa48ab43d6bb410VgnVCM100000171f5a0aRCRD&vgnextoid=cdc10e4d44558110VgnVCM1000000b205a0aRCRD";"CARRIL DEL CONDE";"CALLE";"V";"57";"";"";"";"ubicada en el Centro Cultural Carril del Conde";"MADRID";"MADRID";"28043";"CANILLAS";"HORTALEZA";"444516";"4479119";"40.46088946853693";"-3.654432812836867";"917 161 240";"";"";"/contenido/entidadesYorganismos/SalasEstudioLectura"; 
6953036;"Sala de estudio Centro Cultural Juvenil de Usera";"";"De lunes a viernes, de 9 a 14 y de 15 a 21 horas. Agosto cerrado.";"Puestos de lectura: 20 (Aforo máximo reducido a 9 personas). Zona wifi.";"Metro: Usera (línea 6)  Bus: 55, 60";"";"1";"http://www.madrid.es/sites/v/index.jsp?vgnextchannel=bfa48ab43d6bb410VgnVCM100000171f5a0aRCRD&vgnextoid=9749b68f981ce310VgnVCM1000000b205a0aRCRD";"CUESTA";"CALLE";"V";"4";"";"";"";"En el Centro Cultural Juvenil de Usera";"MADRID";"MADRID";"28026";"MOSCARDO";"USERA";"439956";"4471270";"40.389856130874605";"-3.7074718790538297";"913 920 541";"";"";"/contenido/entidadesYorganismos/SalasEstudioLectura"; 
4812338;"Sala de estudio Centro Dotacional Integrado de Arganzuela";"";"De lunes a sábado, de 9 a 21 horas. Dos turnos:  Mañana: de 9 a 15 horas. Tarde: de 16 a 21 horas.   Agosto cerrado.";"Puestos de lectura (aforo máximo): 74 personas.  INSCRIPCIÓN OBLIGATORIA EN EL MOSTRADOR DEL CENTRO La inscripción será por orden de llegada hasta completar aforo IMPRESCINDIBLE DNI  No está permitido cambiar de ubicación el mobiliario de la sala No se permiten comidas ni bebidas (EXCEPTO AGUA) No está permitido intercambiar puestos con otros usuarios  Zona wifi";"Metro: Palos de la Frontera (línea 3)  Bus: 19, 247, 45, 47, 8, 86, 55, 6, E1, 59, 85  Cercanías RENFE: Delicias (líneas C1, C7, C10)  Bicimad: Estación 120 (calle Palos de la Frontera, 40)";"";"1";"http://www.madrid.es/sites/v/index.jsp?vgnextchannel=bfa48ab43d6bb410VgnVCM100000171f5a0aRCRD&vgnextoid=217024521f048110VgnVCM1000000b205a0aRCRD";"CANARIAS";"CALLE";"V";"17";"";"";"";"Ubicada en el Centro Dotacional Integrado Arganzuela";"MADRID";"MADRID";"28045";"PALOS DE MOGUER";"ARGANZUELA";"440979";"4472617";"40.40207279862862";"-3.6955325387824014";"915 063 610";"";"cdiarganzuela@madrid.es";"/contenido/entidadesYorganismos/SalasEstudioLectura"; 
4815363;"Sala de estudio Centro Juvenil El Sitio de mi Recreo (Villa de Vallecas)";"Edad de 14 a 30 años.";"Consultar telefonicamente";"";"Metro: Villa de Vallecas (línea 1) Bus: 58";"Puestos de lectura: 40";"0";"http://www.madrid.es/sites/v/index.jsp?vgnextchannel=bfa48ab43d6bb410VgnVCM100000171f5a0aRCRD&vgnextoid=af2192cfd9558110VgnVCM1000000b205a0aRCRD";"REAL DE ARGANDA";"CALLE";"V";"39";"";"";"";"";"MADRID";"MADRID";"28031";"SANTA EUGENIA";"VILLA DE VALLECAS";"447634";"4470066";"40.37953682427198";"-3.616901585603186";"913 052 448";"";"";"/contenido/entidadesYorganismos/SalasEstudioLectura"; 
11187831;"Sala de estudio Centro Sociocultural Ciudad Lineal (Ciudad Lineal)";"";"Lunes a viernes de 9  a 13:45 y de 14:15 a 20:30 horas. Julio: de lunes a viernes, de 9 a 14:30 horas. Agosto cerrado.";"Puestos de lectura: 9 Zona wifi";"Bus: 110, 113, 210";"";"1";"http://www.madrid.es/sites/v/index.jsp?vgnextchannel=bfa48ab43d6bb410VgnVCM100000171f5a0aRCRD&vgnextoid=a179d76f718a2710VgnVCM1000001d4a900aRCRD";"POETA BLAS DE OTERO";"CALLE";"V";"81";"";"";"";"";"MADRID";"MADRID";"28017";"VENTAS";"CIUDAD LINEAL";"444717";"4474895";"40.42285715768873";"-3.651680076113881";"917 817 494";"";"";"/contenido/entidadesYorganismos/SalasEstudioLectura"; 
10510680;"Sala de estudio Centro Sociocultural El Greco (Latina)";"";"En horario de funcionamiento del centro:  Lunes a Viernes de 9 a 21:30 horas. Sábados de 9 a 13:30 horas.";"Puestos de lectura: 59. Zona wifi.";"Metro: Lucero (línea 6), Batán (línea 10). Bus: 33, 36, 39, 65.";"";"1";"http://www.madrid.es/sites/v/index.jsp?vgnextchannel=bfa48ab43d6bb410VgnVCM100000171f5a0aRCRD&vgnextoid=bbad79e15d7ee510VgnVCM2000001f4a900aRCRD";"EL GRECO";"CALLE";"V";"29";"";"";"";"";"MADRID";"MADRID";"28024";"LAS AGUILAS";"LATINA";"433786";"4470559";"40.382992678408066";"-3.7800773802118117";"914 793 261 / 914 793 150";"";"";"/contenido/entidadesYorganismos/SalasEstudioLectura"; 
4815051;"Sala de estudio Centro Sociocultural Moratalaz";"";"Lunes a viernes, de 9 a 13:50 y de 15 a 20:50 horas.  Sábados, de 10 a 13:50 y de 16 a 21:40 horas. Domingos, de 10 a 13:50 y de 16:30 a 20:20 horas. Festivos de 10 a 13:50 horas. Julio: lunes a viernes, de 9 a 13:50 y de 15 a 20:50 horas. Sábados, de 16 a 21:60 horas. Domingos y festivos, cerrado. Agosto:  lunes a viernes, de 9 a 13:50 y de 15 a 20:50 horas. Sábados, domingos y festivos, cerrado.";"Puestos de lectura: 80 (reducido 39) Zona wifi.";"Metro: Pavones (línea 9)  Bus: 142, 144, 8, 20, 32, 140";"";"1";"http://www.madrid.es/sites/v/index.jsp?vgnextchannel=bfa48ab43d6bb410VgnVCM100000171f5a0aRCRD&vgnextoid=32c2b51383558110VgnVCM1000000b205a0aRCRD";"FUENTE CARRANTONA";"CALLE";"V";"10";"";"";"";"";"MADRID";"MADRID";"28030";"PAVONES";"MORATALAZ";"445953";"4472221";"40.39883403330691";"-3.636898142855895";"915 880 459";"";"";"/contenido/entidadesYorganismos/SalasEstudioLectura"; 
8026323;"Sala de estudio Centro Sociocultural Siena (Ciudad Lineal)";"";"Lunes a viernes de 9 a 14:30 y de 15 a 21 horas. Agosto cerrado.";"Puestos de lectura: 18 Zona wifi";"Metro: Quintana (línea 5)  Bus: 21, 38";"";"0";"http://www.madrid.es/sites/v/index.jsp?vgnextchannel=bfa48ab43d6bb410VgnVCM100000171f5a0aRCRD&vgnextoid=e4e458caf0f1d410VgnVCM1000000b205a0aRCRD";"SIENA";"CALLE";"V";"52";"";"";"";"UBICADO EN EL CENTRO CULTURAL SIENA";"MADRID";"MADRID";"28027";"QUINTANA";"CIUDAD LINEAL";"444709";"4476040";"40.43316516575713";"-3.651876723048774";"914 039 011";"";"";"/contenido/entidadesYorganismos/SalasEstudioLectura"; 
4814996;"Sala de estudio Centro Sociocultural Talleres de Creatividad (Puente de Vallecas)";"";"Jueves y viernes, de 13:30 a 17 horas. Julio y septiembre, de lunes a viernes de 9:30 a 13:30 horas. Agosto cerrado.";"";"Metro: Nueva Numancia, Portazgo (línea 1).  Bus: 1011, 24, 310, 57, 103.";"Puestos de lectura: 16. Zona wifi.";"0";"http://www.madrid.es/sites/v/index.jsp?vgnextchannel=bfa48ab43d6bb410VgnVCM100000171f5a0aRCRD&vgnextoid=ada6f5fea2558110VgnVCM1000000b205a0aRCRD";"SIERRA CARBONERA";"CALLE";"V";"74";"";"";"";"Ubicada en el Centro Cultural Talleres de Creatividad";"MADRID";"MADRID";"28053";"SAN DIEGO";"PUENTE DE VALLECAS";"443532";"4471268";"40.39009728291889";"-3.665329063724782";"917 570 189 / 917 570 240";"";"";"/contenido/entidadesYorganismos/SalasEstudioLectura"; 
5709413;"Sala de estudio Centro cultural El Torito (Moratalaz)";"";"Lunes a viernes, de 9 a 13:30 y de 15:30 a 21:30 horas. Sábados, de 9 a 13:30 y de 16:30 a 21:30.  Julio, de lunes a viernes, 9 a 13:30 y de 17 a 19:30 horas. Sábados cerrado. Septiembre, de lunes a viernes de 9 a 13:30 y de 17 a 19:30 horas. Sábados de 9 a 13:30 y de 16:30 a 21:30. Agosto cerrado.";"";"Metro: Artilleros (línea 9)  Bus: 32";"Puestos de lectura: 14 Zona wifi";"1";"http://www.madrid.es/sites/v/index.jsp?vgnextchannel=bfa48ab43d6bb410VgnVCM100000171f5a0aRCRD&vgnextoid=3874efd1977f8210VgnVCM1000000b205a0aRCRD";"MORATALAZ";"AVENIDA";"V";"130";"";"";"";"";"MADRID";"MADRID";"28030";"VINATEROS";"MORATALAZ";"445141";"4473033";"40.40609591857167";"-3.646536107063507";"913 287 385 / 914 306 940";"";"";"/contenido/entidadesYorganismos/SalasEstudioLectura"; 
8000760;"Sala de estudio Centro cultural Lope de Vega (Puente de Vallecas)";"";"De lunes a viernes, de 8:30 a 21:30 horas, sábados, domingos y festivos cerrada. Julio, de lunes a viernes, de 8:30 a 15 horas. Agosto cerrada. Semana de San Isidro, de lunes a viernes de 8:30 a 21:30 horas.";"Puestos de lectura: 32 (reducido por COVID-19 a 13 puestos). Zona wifi.";"Bus: 102, 24.  Cercanías Renfe: Asamblea de Madrid-Entrevías (línea C2).";"";"1";"http://www.madrid.es/sites/v/index.jsp?vgnextchannel=bfa48ab43d6bb410VgnVCM100000171f5a0aRCRD&vgnextoid=a190e189b66dc410VgnVCM2000000c205a0aRCRD";"CONCEJO DE TEVERGA";"CALLE";"V";"1";"";"";"";"Ubicada en el centro Cultural Lope de Vega";"MADRID";"MADRID";"28053";"ENTREVIAS";"PUENTE DE VALLECAS";"442974";"4470850";"40.386293684801885";"-3.6718658006661906";"917 570 580";"";"";"/contenido/entidadesYorganismos/SalasEstudioLectura"; 
4816516;"Sala de estudio Centro cultural Rafael Altamira, antes Palacete Quinta del Berro (Salamanca)";"";"";"";"Bus: 15, 28, 71";"";"1";"http://www.madrid.es/sites/v/index.jsp?vgnextchannel=bfa48ab43d6bb410VgnVCM100000171f5a0aRCRD&vgnextoid=1947371b6e958110VgnVCM1000000b205a0aRCRD";"ENRIQUE D'ALMONTE";"CALLE";"V";"1";"";"";"";"ubicada en el Centro Cultural Quinta del Berro";"MADRID";"MADRID";"28028";"FUENTE DEL BERRO";"SALAMANCA";"443760";"4474815";"40.42206608753629";"-3.662956288628484";"915 570 807 / 915 570 808 / 915 570 809";"";"";"/contenido/entidadesYorganismos/SalasEstudioLectura"; 
4814317;"Sala de estudio Centro sociocultural Cánovas del Castillo (Usera)";"";"De lunes a viernes de 9 a 14 y de 15 a 21:30 horas. Sábados de 9 a 14 horas. Agosto cerrado.";"Puestos de lectura: 44 (aforo reducido a 15 personas) Zona wifi";"Metro: Almendrales (línea 3)  Bus: 47, 247, 6, 78, 18, 22, 59, 76, 79, 85, 86, 23, 123";"";"1,4";"http://www.madrid.es/sites/v/index.jsp?vgnextchannel=bfa48ab43d6bb410VgnVCM100000171f5a0aRCRD&vgnextoid=b10c750b1c058110VgnVCM2000000c205a0aRCRD";"JULIO AGUIRRE";"CALLE";"V";"10";"";"";"";"y 12";"MADRID";"MADRID";"28026";"ALMENDRALES";"USERA";"440579";"4470866";"40.38626143332092";"-3.7000825227295007";"915 005 489";"";"";"/contenido/entidadesYorganismos/SalasEstudioLectura"; 
8071924;"Sala de estudio Ciudad Pegaso (San Blas - Canillejas)";"";"Lunes a viernes de 9:30 a 14:30 y de 16:30 a 21:30 horas.";"";"Bus: 77";"Puestos de lectura: 24 Zona wifi";"1";"http://www.madrid.es/sites/v/index.jsp?vgnextchannel=bfa48ab43d6bb410VgnVCM100000171f5a0aRCRD&vgnextoid=df3576e159ead410VgnVCM1000000b205a0aRCRD";"SÉPTIMA";"AVENIDA";"V";"11";"";"";"";"ubicado en el Centro Cultural Ciudad Pegaso";"MADRID";"MADRID";"28022";"REJAS";"SAN BLAS-CANILLEJAS";"449282";"4477702";"40.448428925762634";"-3.5980969888187393";"913 209 770 / 917 415 852";"";"";"/contenido/entidadesYorganismos/SalasEstudioLectura"; 
4815414;"Sala de estudio El Madroño (Vicálvaro)";"";"Sábados, domingos y festivos de 9 a 14 y de 16 a 19:45 horas.  Cerrada los días festivos de Navidad y Reyes.";"";"Metro: Vicálvaro (línea 9).  Bus: 130, 100, 106, 4.";"Puestos de lectura: 30. Zona wifi.";"1";"http://www.madrid.es/sites/v/index.jsp?vgnextchannel=bfa48ab43d6bb410VgnVCM100000171f5a0aRCRD&vgnextoid=62c0c0e48a558110VgnVCM1000000b205a0aRCRD";"VILLARDONDIEGO";"CALLE";"V";"36";"";"";"";"";"MADRID";"MADRID";"28032";"CASCO H.VICALVARO";"VICALVARO";"448357";"4472920";"40.405292721436055";"-3.6086161200017157";"917 753 140";"";"";"/contenido/entidadesYorganismos/SalasEstudioLectura"; 
5753713;"Sala de estudio Fernando Lázaro Carreter (Carabanchel)";"";"Lunes a viernes: de 9 a 14 y de 16:30 a 20:30 horas. Sábados: de 10 a 13:30 y de 16:30 a 20:30 horas. Domingos, agosto y festivos cerrado.";"Puestos de lectura: 40 (consultar aforo reducido) Zona wifi";"Bus: 116  Metro: Marqués de Vadillo (línea 5), Plaza Elíptica (línea 6 y 11)";"";"1";"http://www.madrid.es/sites/v/index.jsp?vgnextchannel=bfa48ab43d6bb410VgnVCM100000171f5a0aRCRD&vgnextoid=b0bb1c35f67a9210VgnVCM1000000b205a0aRCRD";"VERDAD";"CALLE";"V";"29";"";"";"";"";"MADRID";"MADRID";"28019";"OPAÑEL";"CARABANCHEL";"439136";"4471474";"40.39164343238081";"-3.717140510927299";"914 690 895";"";"";"/contenido/entidadesYorganismos/SalasEstudioLectura"; 
6924985;"Sala de estudio Francisco José González Tejera (Hortaleza)";"";"Horario habitual: de lunes a domingos y festivos, de 9 a 22 horas. Horario verano: de lunes a domingos y festivos, de 9 a 22 horas.";"Puestos de lectura: 56 Wifi";"Metro: Parque de Santa María (línea 4)  Bus: 72, 87, 107";"";"1";"http://www.madrid.es/sites/v/index.jsp?vgnextchannel=bfa48ab43d6bb410VgnVCM100000171f5a0aRCRD&vgnextoid=dd6f094110a5e310VgnVCM1000000b205a0aRCRD";"SANTA VIRGILIA";"CALLE";"V";"15";"";"";"";"ubicada en el Centro Cultural Hortaleza";"MADRID";"MADRID";"28033";"PINAR DEL REY";"HORTALEZA";"445577";"4480884";"40.47685971480448";"-3.6420589279590887";"913 821 493";"";"";"/contenido/entidadesYorganismos/SalasEstudioLectura"; 
5753557;"Sala de estudio Galileo (Chamberí)";"";"De lunes a viernes, de 9 a 14 y de 15 a 21 horas. Sábados, domingos y festivos, de 9:30 a 14 y de 15 a 20:30 horas.";"Puestos de lectura: 50.";"Metro: Moncloa (líneas 3, 6) , Quevedo (línea 2)  Bus: 2, 16, 61  Bicimad: 127 (calle Fernando el Católico, 19)";"";"1";"http://www.madrid.es/sites/v/index.jsp?vgnextchannel=bfa48ab43d6bb410VgnVCM100000171f5a0aRCRD&vgnextoid=08a9964bd47a9210VgnVCM1000000b205a0aRCRD";"GALILEO";"CALLE";"V";"39";"";"";"";"";"MADRID";"MADRID";"28015";"ARAPILES";"CHAMBERI";"439741";"4476139";"40.43371190964793";"-3.7104543597957758";"915 913 901";"";"";"/contenido/entidadesYorganismos/SalasEstudioLectura"; 
8071938;"Sala de estudio José Luis López Vázquez (San Blas - Canillejas)";"";"De lunes a viernes, de 9 a 13:30 y de 16 a 20:30 horas. Sábados: De 9 a 13:30 horas. Domingos y festivos y agosto: cerrado.";"";"Bus: 167, 77";"Puestos de lectura: 57 Zona wifi";"2";"http://www.madrid.es/sites/v/index.jsp?vgnextchannel=bfa48ab43d6bb410VgnVCM100000171f5a0aRCRD&vgnextoid=9db676e159ead410VgnVCM1000000b205a0aRCRD";"FEBRERO";"CALLE";"V";"4";"En la 2ª Planta del edificio";"";"";"ubicada en el Centro Cultural Jose Luis López Vázquez";"MADRID";"MADRID";"28022";"REJAS";"SAN BLAS-CANILLEJAS";"451431";"4477509";"40.446818592300296";"-3.572741163820915";"913 293 900";"";"";"/contenido/entidadesYorganismos/SalasEstudioLectura"; 
4813757;"Sala de estudio Julio Cortázar (Moncloa-Aravaca)";"";"De lunes a sábado de 9 a 14 y de 15 a 21 horas.  Cerrado: Domingos y festivos, 24, 25 y 31 de diciembre, 1 de enero y 15 de agosto.";"";"Metro: Valdezarza (línea 7) y Antonio Machado (línea 7).  Bus: 127, 132, 126.";"Puestos de lectura: 65 (de los 125 quedan reducidos a 65 por motivos de seguridad sanitaria). Zona wifi.";"1";"http://www.madrid.es/sites/v/index.jsp?vgnextchannel=bfa48ab43d6bb410VgnVCM100000171f5a0aRCRD&vgnextoid=53918917a2058110VgnVCM2000000c205a0aRCRD";"ANTONIO MACHADO";"CALLE";"V";"20";"";"";"";"Ubicada en el Centro Cultural Julio Cortázar";"MADRID";"MADRID";"28035";"VALDEZARZA";"MONCLOA-ARAVACA";"438998";"4479816";"40.46678159096302";"-3.7195669111891703";"913 734 375";"";"";"/contenido/entidadesYorganismos/SalasEstudioLectura"; 
4815257;"Sala de estudio Los Rosales";"";"Consultar telefónicamente.";"Puestos de lectura: 32";"Bus: 85 Renfe: Villaverde Bajo";"";"1";"http://www.madrid.es/sites/v/index.jsp?vgnextchannel=bfa48ab43d6bb410VgnVCM100000171f5a0aRCRD&vgnextoid=1bcbc1e158558110VgnVCM1000000b205a0aRCRD";"LOS ROSALES";"AVENIDA";"V";"133";"";"";"";"";"MADRID";"MADRID";"28021";"BUTARQUE";"VILLAVERDE";"442592";"4467116";"40.35074797433515";"-3.6773064421969233";"917 109 273";"";"";"/contenido/entidadesYorganismos/SalasEstudioLectura"; 
6468021;"Sala de estudio Luis García Berlanga (Tetuán)";"";"De lunes a domingo, de 9 a 21 horas Festivos cerrado";"Puestos de lectura (aforo restringido): 19 personas (podrá verse modificado) Zona wifi";"Metro: Valdeacederas (línea 1)  Bus: 49 , 66, 124";"";"1";"http://www.madrid.es/sites/v/index.jsp?vgnextchannel=bfa48ab43d6bb410VgnVCM100000171f5a0aRCRD&vgnextoid=f5abe23a26bd7310VgnVCM1000000b205a0aRCRD";"VIÑA VIRGEN";"CALLE";"V";"2";"";"";"";"";"MADRID";"MADRID";"28029";"ALMENARA";"TETUAN";"441159";"4479632";"40.46527083469685";"-3.6940726509061683";"915 133 253";"";"";"/contenido/entidadesYorganismos/SalasEstudioLectura"; 
4812602;"Sala de estudio Luis Gonzaga (Chamartín)";"";"De lunes a domingo, 9 a 21:30 horas.  Cerrado: festivos y mes de agosto.  Fuera de este horario el centro permanecerá abierto durante la celebración de las actividades que se programen.";"Puestos de lectura: 98 (reducido 32) Zona wifi";"Metro: Cruz del Rayo (línea 9)  Bus: 29, 52, 1  Bicimad: Estación 146 (calle María Francisca, 1)";"";"1";"http://www.madrid.es/sites/v/index.jsp?vgnextchannel=bfa48ab43d6bb410VgnVCM100000171f5a0aRCRD&vgnextoid=e653d0a471148110VgnVCM1000000b205a0aRCRD";"PRINCIPE DE VERGARA";"CALLE";"V";"142";"";"";"";"ubicada en el Centro Sociocultural Luis Gonzaga";"MADRID";"MADRID";"28002";"CIUDAD JARDIN";"CHAMARTIN";"442496";"4477359";"40.44489723228663";"-3.6780972922453685";"915 886 596";"";"";"/contenido/entidadesYorganismos/SalasEstudioLectura"; 
5753512;"Sala de estudio Maestro Alonso (Salamanca)";"";"";"";"Metro: Ventas (líneas 2, 5)  Bus: 12, 21, 53, 106, 110, 146, 210, 38  Bicimad: Estación 187 (calle Alejandro González, 1)";"Puestos de lectura: 26 Zona wifi";"1";"http://www.madrid.es/sites/v/index.jsp?vgnextchannel=bfa48ab43d6bb410VgnVCM100000171f5a0aRCRD&vgnextoid=e894be85b37a9210VgnVCM1000000b205a0aRCRD";"MAESTRO ALONSO";"CALLE";"V";"6";"";"";"";"(ubicada en el Centro Cultural Maestro Alonso)";"MADRID";"MADRID";"28028";"FUENTE DEL BERRO";"SALAMANCA";"443605";"4475629";"40.42938854032785";"-3.664855511110751";"913 560 807 / 917 268 800";"";"";"/contenido/entidadesYorganismos/SalasEstudioLectura"; 
